{
  "utds_version": "1.0.0",
  "export_id": "exp-reh3376-mdemg-dev-20260401-143022",
  "instance_id": "reh3376-mdemg-dev",
  "space_id": "mdemg-dev",
  "mdemg_version": "edge-c579fdc",
  "mdemg_commit": "c579fdc",
  "schema_version": 8,
  "exported_at": "2026-04-01T14:30:22Z",
  "data_range": {
    "from": "2026-03-31T10:41:49Z",
    "to": "2026-04-01T14:30:00Z"
  },
  "tables": {
    "llm_interactions": {
      "row_count": 388,
      "sha256": "a1b2c3d4e5f6a7b8c9d0e1f2a3b4c5d6e7f8a9b0c1d2e3f4a5b6c7d8e9f0a1b2",
      "columns": [
        "time", "trace_id", "task_name", "space_id", "session_id",
        "system_prompt", "user_prompt", "response", "think_content", "think_mode",
        "latency_ms", "tokens_in", "tokens_out", "model_name", "provider",
        "error", "quality", "quality_source", "used_for_train", "dataset_ver",
        "guidance_id", "source_path", "retrieval_node_ids", "retrieval_scores",
        "oracle_node_id", "system_prompt_hash",
        "instance_id"
      ],
      "task_names": ["retrieval.rerank_cross", "hidden.reclassify"],
      "system_prompt_hashes": [
        "8a7750d2893929ed53fed531021190be391fd231d792df519f892a06d024046b",
        "b3f2e1a4c5d6e7f8a9b0c1d2e3f4a5b6c7d8e9f0a1b2c3d4e5f6a7b8c9d0e1f2"
      ]
    },
    "retrieval_events": {
      "row_count": 360,
      "sha256": "d4e5f6a7b8c9d0e1f2a3b4c5d6e7f8a9b0c1d2e3f4a5b6c7d8e9f0a1b2c3d4e5",
      "columns": [
        "time", "event_id", "space_id", "call_site", "query_text", "query_hash",
        "recall_node_ids", "recall_scores", "recall_k",
        "bm25_node_ids", "bm25_scores",
        "rerank_node_ids", "rerank_scores", "rerank_model",
        "result_node_ids", "result_scores", "result_count",
        "guidance_id", "downstream_quality",
        "recall_latency_ms", "rerank_latency_ms", "total_latency_ms",
        "instance_id"
      ]
    },
    "embedding_events": {
      "row_count": 23000,
      "sha256": "f6a7b8c9d0e1f2a3b4c5d6e7f8a9b0c1d2e3f4a5b6c7d8e9f0a1b2c3d4e5f6a7",
      "columns": [
        "time", "event_id", "event_type", "space_id", "text_content", "text_hash",
        "text_length", "element_kind", "language", "file_path",
        "chunk_start", "chunk_end", "package_name", "signature", "tags",
        "call_site", "query_text", "model_name", "provider", "dimensions",
        "latency_ms", "cached", "node_id",
        "instance_id"
      ]
    }
  },
  "quality_summary": {
    "llm_error_rate": 0.0,
    "llm_empty_system_prompt": 0,
    "llm_empty_response": 0,
    "embedding_empty_call_sites": 0,
    "retrieval_recall_rate": 1.0,
    "privacy_scrub_violations": 0
  },
  "environment": {
    "os": "darwin",
    "arch": "arm64",
    "go_version": "1.24",
    "llm_provider": "openai",
    "llm_model": "gpt-4.1",
    "embedding_model": "text-embedding-3-large",
    "embedding_dimensions": 3072
  }
}
